{
  "schema": {
    "name": "scfm_eval.execution_manifest",
    "version": "1.0.0"
  },
  "manifest_id": "example-cell-model-run-v1",
  "created_at": "2026-07-17T22:10:00Z",
  "model_spec_fingerprint": "bbbbbbbbbbbbbbbbbbbbbbbbbbbbbbbbbbbbbbbbbbbbbbbbbbbbbbbbbbbbbbbb",
  "integration_plan_fingerprint": "cccccccccccccccccccccccccccccccccccccccccccccccccccccccccccccccc",
  "repository": {
    "url": "https://example.org/example-cell-model.git",
    "commit": "1111111111111111111111111111111111111111"
  },
  "weights": [
    {
      "artifact_id": "base-checkpoint",
      "url": "https://example.org/example-cell-model/weights.bin",
      "sha256": "2222222222222222222222222222222222222222222222222222222222222222",
      "filename": "weights/base.bin",
      "access": "public"
    }
  ],
  "generated_files": [
    {
      "path": "pixi.lock",
      "purpose": "Locked execution environment",
      "sha256": "3333333333333333333333333333333333333333333333333333333333333333"
    },
    {
      "path": "integrations/example_cell_model.py",
      "purpose": "Evaluation adapter",
      "sha256": "4444444444444444444444444444444444444444444444444444444444444444"
    },
    {
      "path": "experiments/example_cell_model.yaml",
      "purpose": "Resolved evaluation configuration",
      "sha256": "5555555555555555555555555555555555555555555555555555555555555555"
    }
  ],
  "environment": {
    "name": "example-cell-model",
    "lock_path": "pixi.lock",
    "lock_sha256": "3333333333333333333333333333333333333333333333333333333333333333"
  },
  "evaluation": {
    "experiment_path": "experiments/example_cell_model.yaml",
    "adapter_module": "integrations.example_cell_model",
    "adapter_class": "ExampleCellModelAdapter",
    "output_subdir": "example-cell-model/run-1",
    "tasks": [
      "cell_type"
    ]
  },
  "steps": [
    "checkout",
    "create_environment",
    "install",
    "download_weights",
    "smoke_test",
    "evaluate",
    "collect_results"
  ],
  "resources": {
    "gpu_type": "Example GPU",
    "gpu_count": 1,
    "disk_gb": 50,
    "max_runtime_minutes": 60,
    "hourly_rate_usd": 2,
    "max_budget_usd": 5
  },
  "permissions": {
    "network_hosts": [
      "example.org"
    ],
    "secret_names": [],
    "dataset_read_only": true
  },
  "retry_policy": {
    "max_attempts": 2,
    "retryable_steps": [
      "download_weights",
      "evaluate"
    ]
  },
  "expected_outputs": [
    "results.json",
    "resolved_config.yaml",
    "execution.log"
  ]
}
